{
  "snapshotId": "<SNAPSHOT_ID>",
  "project": "<PROJECT_NAME>",
  "environment": "staging",
  "sourceType": "owner-provided",
  "capturedBy": "<who/what produced this static file>",
  "capturedAt": "2026-06-30",
  "sourceLimitations": "<what this static snapshot could NOT verify>",
  "branch": "<BRANCH>",
  "commit": "<COMMIT>",
  "targetUrl": "URL_PLACEHOLDER",
  "hostingProvider": "<vercel|netlify|other>",
  "databaseProvider": "<supabase|other>",
  "projectRef": "PROJECT_REF_PLACEHOLDER",
  "forbiddenRefs": ["FORBIDDEN_REF_PLACEHOLDER"],
  "expectedTables": ["<table>"],
  "expectedColumns": ["<table.column>"],
  "expectedFunctions": ["<db-function>"],
  "expectedRoutes": ["</route>"],
  "expectedMigrations": ["<migration-id>"],
  "expectedEnvKeys": ["<ENV_KEY_NAME>"],
  "expectedPolicies": ["<rls-policy>"],
  "notes": "<notes; no secrets>"
}