{
  "snapshotId": "demo-observed-001",
  "project": "Demo SaaS Platform",
  "environment": "staging",
  "sourceType": "owner-provided",
  "capturedBy": "owner manual export (static file)",
  "capturedAt": "2026-06-30",
  "sourceLimitations": "Static observed snapshot; not derived from a live connection.",
  "branch": "staging-fix",
  "commit": "OBSERVED_COMMIT_BBB",
  "targetUrl": "URL_PLACEHOLDER",
  "hostingProvider": "vercel",
  "databaseProvider": "supabase",
  "projectRef": "FORBIDDEN_REF_PLACEHOLDER",
  "forbiddenRefs": ["FORBIDDEN_REF_PLACEHOLDER"],
  "expectedTables": ["users", "invoices"],
  "expectedColumns": ["users.id", "invoices.total"],
  "expectedFunctions": ["recalculate_booking_totals"],
  "expectedRoutes": ["/login", "/dashboard", "/debug"],
  "expectedMigrations": ["0001_init", "0002_bookings"],
  "expectedEnvKeys": ["SUPABASE_URL"],
  "expectedPolicies": ["users_rls", "bookings_rls"],
  "notes": "Inert demo observed snapshot with intentional drift: missing table bookings, missing column bookings.venue_id, extra route /debug, missing env key RESEND_FROM, branch drift, projectRef points at FORBIDDEN_REF_PLACEHOLDER."
}